{
  "requestId": "synthetic-request-review-003",
  "owner": "synthetic-owner-platform",
  "workloadIdentity": "synthetic-workload-knowledge-lookup",
  "route": "gateway-only",
  "capability": "knowledge-search",
  "accessMode": "read-only",
  "knowledgeBoundaryId": "synthetic-approved-handbook",
  "riskTier": "elevated",
  "sessionLimit": 3,
  "budgetLimit": 10,
  "requestedAt": "2026-08-14T00:02:00Z"
}
